{
  "$schema": "https://json-schema.org/draft/2020-12/schema",
  "$id": "https://secret-sauce.local/schema/recipe.json",
  "title": "Secret Sauce curated recipe",
  "description": "One authored recipe, in the shape the app's own model uses. Fields map 1:1 onto `recipes` / `ingredient_groups` / `ingredients` / `step_groups` / `steps` in supabase/migrations/0001_init.sql — see docs/SDS.md §3-§6. `tool/recipes.dart` validates against these rules and generates supabase/seed_recipes.sql; it does NOT read this file (no JSON Schema dependency in the toolchain), so a rule added here must be added there too.",
  "type": "object",
  "required": [
    "slug",
    "title",
    "description",
    "difficulty",
    "prep_minutes",
    "cook_minutes",
    "servings",
    "ingredient_groups",
    "step_groups"
  ],
  "additionalProperties": false,
  "properties": {
    "demo": {
      "not": {},
      "description": "RETIRED AND REJECTED (B112). Carried authored like_count/save_count/view_count plus taster ratings straight into supabase/seed_recipes.sql, so a curated recipe shipped claiming 412 likes with zero recipe_likes rows behind it. A curated recipe now lands with every counter at zero; engagement is earned by real readers, or generated by the sim into a throwaway database. tool/recipe_format.dart names this key in `_retiredRecipeKeys` and errors on it."
    },
    "slug": {
      "type": "string",
      "pattern": "^[a-z0-9]+(-[a-z0-9]+)*$",
      "description": "Repo-level identity. MUST equal the filename without .json — that is what makes duplicates impossible by construction. Not a database column: `recipes` has no slug, and seed_recipe_v2 still dedupes on (owner_id, title), so renaming `title` creates a second row even if the slug is unchanged.",
      "examples": ["spring-vegetable-tart"]
    },
    "title": {
      "type": "string",
      "minLength": 1,
      "maxLength": 120,
      "description": "recipes.title. The de-facto import key — see `slug`."
    },
    "description": {
      "type": "string",
      "minLength": 1,
      "description": "recipes.description. Shown truncated on recipe cards, so lead with the dish. Yield that does not fit an integer `servings` (pan size, tart diameter, piece count) belongs here."
    },
    "cuisine": {
      "type": ["string", "null"],
      "description": "recipes.cuisine. Free text in Postgres; keep it to a recognisable cuisine name so Discover's filters stay coherent."
    },
    "category": {
      "type": ["string", "null"],
      "description": "recipes.category. Free text in Postgres; this enum is a repo convention only, to stop 'Mains'/'Main'/'main' drift.",
      "enum": [
        "Appetizer",
        "Breakfast",
        "Main",
        "Side",
        "Salad",
        "Soup",
        "Dessert",
        "Drink",
        "Snack",
        "Sauce",
        null
      ]
    },
    "difficulty": {
      "enum": ["easy", "medium", "hard"],
      "description": "recipes.difficulty — the Postgres `difficulty` enum, mirrored in packages/core/lib/src/models/enums.dart. Wire values are lowercase."
    },
    "prep_minutes": {
      "type": "integer",
      "minimum": 0,
      "maximum": 1440,
      "description": "recipes.prep_minutes — hands-on time only. Unattended time (chilling, rising, marinating) goes on the step that waits, as duration_minutes, so the detail screen can show it as a timer instead of inflating the headline time."
    },
    "cook_minutes": {
      "type": "integer",
      "minimum": 0,
      "maximum": 1440,
      "description": "recipes.cook_minutes. 0 for no-cook recipes."
    },
    "servings": {
      "type": "integer",
      "minimum": 1,
      "maximum": 100,
      "description": "recipes.servings — an integer because the recipe detail screen scales every ingredient quantity by target/servings. Free text here is what made the old flat data unusable."
    },
    "visibility": {
      "enum": ["public", "private"],
      "default": "public",
      "description": "recipes.visibility — the Postgres `recipe_visibility` enum. Curated kitchen recipes are public; RLS is what actually enforces this."
    },
    "attribution": {
      "type": ["string", "null"],
      "description": "recipes.attribution — where the recipe came from, if not original."
    },
    "notes": {
      "type": ["string", "null"],
      "description": "Recipe-level note (variation, substitution, make-ahead). `recipes` has NO notes column, so tool/recipes.dart appends this to `description` as a trailing paragraph. Lossless but not ideal — a real `notes` column is the proper fix (docs/ROADMAP.md)."
    },
    "nutrition": {
      "type": ["object", "null"],
      "additionalProperties": false,
      "minProperties": 1,
      "description": "recipes.nutrition — the per-serving nutrition-facts label, as ONE jsonb column rather than eleven numerics. Values are per serving at THIS recipe's `servings` and are never multiplied by the detail screen's servings scaler (scaling 4->8 doubles the batch and the servings, so a serving is unchanged). Every field is optional; `null` — not `{}` — is the one representation of \"no nutrition info\", and the detail screen's Nutrition tab renders its empty state from it. Mirrored by RecipeNutrition in packages/core and by _nutritionKeys in tool/recipe_format.dart; unknown keys are a hard error there because the jsonb column itself would accept them. `source` is the twelfth key and the only non-numeric one (Phase 29c).",
      "properties": {
        "calories": { "type": "number", "minimum": 0, "description": "kcal per serving. No % Daily Value is printed for calories, as on a real label." },
        "total_fat_g": { "type": "number", "minimum": 0, "description": "Grams. %DV against 78 g." },
        "saturated_fat_g": { "type": "number", "minimum": 0, "description": "Grams, indented under total fat. %DV against 20 g." },
        "trans_fat_g": { "type": "number", "minimum": 0, "description": "Grams, indented under total fat. No %DV — there is no established daily value." },
        "cholesterol_mg": { "type": "number", "minimum": 0, "description": "Milligrams. %DV against 300 mg." },
        "sodium_mg": { "type": "number", "minimum": 0, "description": "Milligrams. %DV against 2,300 mg." },
        "total_carbs_g": { "type": "number", "minimum": 0, "description": "Grams. %DV against 275 g." },
        "dietary_fiber_g": { "type": "number", "minimum": 0, "description": "Grams, indented under total carbohydrate. %DV against 28 g." },
        "total_sugars_g": { "type": "number", "minimum": 0, "description": "Grams, indented under total carbohydrate. No %DV — only added sugars carry one." },
        "added_sugars_g": { "type": "number", "minimum": 0, "description": "Grams, indented under total sugars. %DV against 50 g." },
        "protein_g": { "type": "number", "minimum": 0, "description": "Grams. %DV against 50 g." },
        "source": { "const": "auto", "description": "Provenance (Phase 29c). `\"auto\"` means the eleven numbers above were computed from this file's ingredient `food` links by estimate_nutrition() — the label then prints an `Estimated from ingredients` footnote. MANUAL IS SPELLED BY ABSENCE: there is no `\"manual\"` value, which is what made the key migration-free for every label written before it existed. An object carrying ONLY `source` is rejected like an empty one — use `null` for \"no info\". Regenerate an auto label whenever the recipe's ingredients or nutritionData/ change; `recompute_auto_nutrition()` in 0001_init.sql does the same job for a database that already holds the recipe." }
      }
    },
    "ingredient_groups": {
      "type": "array",
      "minItems": 1,
      "description": "ingredient_groups rows, in array order (sort_order 0..n). Use one group with an empty name for a simple recipe; use named groups whenever the same ingredient appears at two amounts in two components (marinade vs sauce), because a flat list makes that read like a duplicate.",
      "items": {
        "type": "object",
        "required": ["name", "ingredients"],
        "additionalProperties": false,
        "properties": {
          "name": {
            "type": "string",
            "description": "ingredient_groups.name. Empty string for the single unnamed group."
          },
          "ingredients": {
            "type": "array",
            "minItems": 1,
            "items": { "$ref": "#/$defs/ingredient" }
          }
        }
      }
    },
    "step_groups": {
      "type": "array",
      "minItems": 1,
      "description": "step_groups rows, in array order (sort_order 0..n). step_order restarts at 0 in each group, matching SupabaseRecipeRepository._persistContent — numbering continuously across groups would silently renumber every step the first time a user edited the recipe.",
      "items": {
        "type": "object",
        "required": ["name", "steps"],
        "additionalProperties": false,
        "properties": {
          "name": {
            "type": "string",
            "description": "step_groups.name. Empty string for the single unnamed group."
          },
          "steps": {
            "type": "array",
            "minItems": 1,
            "items": { "$ref": "#/$defs/step" }
          }
        }
      }
    }
  },
  "$defs": {
    "ingredient": {
      "type": "object",
      "required": ["name"],
      "additionalProperties": false,
      "properties": {
        "quantity": {
          "type": ["number", "null"],
          "exclusiveMinimum": 0,
          "description": "ingredients.quantity (Postgres numeric). Decimal, never a fraction string — '1 1/4 cup' cannot be scaled, 1.25 can. Null for 'to taste' / 'for frying' style entries; put the qualifier in `note`. For a range, use the amount you would actually reach for and describe the range in `note`."
        },
        "unit": {
          "type": ["string", "null"],
          "description": "ingredients.unit. Null for countable items ('2 eggs'). The app prints this VERBATIM beside the quantity (formatting.dart: '$amount $unit'), so the spelling is user-visible and nothing pluralises it at render time. Two rules follow. ABBREVIATION units are lowercase and invariant at every quantity: g, kg, ml, L, tsp, tbsp, oz, lb - never Tbsp, tablespoon(s), teaspoon(s), tbsps, grams, ounces, pound(s), lbs, litres. L for litres is the one deliberate departure from nutritionData/units.json's `l` key, because a lowercase l reads as a 1; matching is case-insensitive so it resolves identically. WORD units keep the plural a cook would actually read, because nothing adds it later: cup/cups, clove/cloves, slice/slices, stick/sticks, stalk/stalks, bunch/bunches, pinch, handful, pkg, pouch, pint. Any spelling not listed in nutritionData/units.json contributes NOTHING to an auto nutrition estimate - silently - so a new unit belongs in that file first. ENFORCED by tool/recipe_format.dart (BL-8) against each unit's `display` / `plural` in units.json: a spelling that resolves to a known unit but is not its canonical form is an ERROR (Tbsp, tablespoons, grams, l, lbs, package), as is a word unit disagreeing with the quantity (above 1 takes the plural, exactly 1 the singular, below 1 or null either) and a blank string (use null); a spelling absent from units.json entirely is a WARNING."
        },
        "name": {
          "type": "string",
          "minLength": 1,
          "description": "ingredients.name — the ingredient alone, lowercase unless it is a proper noun (Dijon, Gruyère, Gouda). Preparation goes in `note`, not here."
        },
        "note": {
          "type": ["string", "null"],
          "description": "ingredients.note — preparation or qualifier ('finely chopped', 'to taste', 'divided')."
        },
        "is_optional": {
          "type": "boolean",
          "default": false,
          "description": "ingredients.is_optional. Use this instead of writing '(optional)' into the name."
        },
        "food": {
          "type": ["string", "null"],
          "pattern": "^[a-z0-9]+(-[a-z0-9]+)*$",
          "description": "ingredients.food_id — the link into the food registry (Phase 29b). Must be a slug that exists in nutritionData/foods.json; tool/recipe_format.dart enforces that, because the generated SQL carries it into a real FK column. Optional and invisible to every rendered surface: `name` stays the cook's words, this is what auto nutrition (29c) sums. Leave it off for the documented registry gaps (mirin, spice blends, composites — see nutritionData/README.md)."
        }
      }
    },
    "step": {
      "type": "object",
      "required": ["text"],
      "additionalProperties": false,
      "properties": {
        "text": {
          "type": "string",
          "minLength": 1,
          "description": "steps.text — one action per step. Every ingredient a step names must exist in ingredient_groups; every ingredient must be used by some step. tool/recipes.dart warns on both (that mismatch was the whole of B025)."
        },
        "duration_minutes": {
          "type": ["integer", "null"],
          "minimum": 1,
          "maximum": 2880,
          "description": "steps.duration_minutes — drives the in-step timer. Set it for waits too (chill, rise, marinate); those are deliberately excluded from prep_minutes."
        },
        "temperature": {
          "type": ["string", "null"],
          "description": "steps.temperature, as written to the cook, e.g. '350°F' or 'medium-low'."
        },
        "tip": {
          "type": ["string", "null"],
          "description": "steps.tip — the doneness cue or the thing that goes wrong. Rendered as an aside, so it must not carry an instruction the step needs."
        }
      }
    }
  }
}
