{
  "slug": "fluffy-buttermilk-pancakes",
  "title": "Fluffy Buttermilk Pancakes",
  "description": "Tall, tender pancakes with a golden crust — a weekend breakfast staple.",
  "cuisine": "American",
  "category": "Breakfast",
  "difficulty": "easy",
  "prep_minutes": 10,
  "cook_minutes": 15,
  "servings": 4,
  "visibility": "public",
  "attribution": null,
  "notes": null,
  "nutrition": {
    "calories": 345,
    "total_fat_g": 12.4,
    "saturated_fat_g": 7.0,
    "trans_fat_g": 0.0,
    "cholesterol_mg": 77,
    "sodium_mg": 674,
    "total_carbs_g": 48.7,
    "dietary_fiber_g": 1.4,
    "total_sugars_g": 10.3,
    "added_sugars_g": 6.3,
    "protein_g": 9.3,
    "source": "auto"
  },
  "ingredient_groups": [
    {
      "name": "Dry",
      "ingredients": [
        { "quantity": 200, "unit": "g", "name": "all-purpose flour", "food": "all-purpose-flour" },
        { "quantity": 2, "unit": "tbsp", "name": "sugar", "food": "granulated-sugar" },
        { "quantity": 1, "unit": "tsp", "name": "baking powder", "food": "baking-powder" },
        { "quantity": 0.5, "unit": "tsp", "name": "baking soda", "food": "baking-soda" },
        { "quantity": 0.5, "unit": "tsp", "name": "salt", "food": "kosher-salt" }
      ]
    },
    {
      "name": "Wet",
      "ingredients": [
        { "quantity": 300, "unit": "ml", "name": "buttermilk", "food": "buttermilk" },
        { "quantity": 1, "unit": null, "name": "egg", "food": "egg" },
        { "quantity": 40, "unit": "g", "name": "butter", "note": "melted", "food": "butter" }
      ]
    }
  ],
  "step_groups": [
    {
      "name": "",
      "steps": [
        {
          "text": "Whisk the dry ingredients together in a bowl."
        },
        {
          "text": "In another bowl, whisk the buttermilk, egg, and melted butter."
        },
        {
          "text": "Fold the wet into the dry until just combined.",
          "tip": "Lumps are fine. Overmixing develops gluten and gives you flat, rubbery pancakes."
        },
        {
          "text": "Rest the batter so the leavening activates.",
          "duration_minutes": 5
        },
        {
          "text": "Cook ladlefuls on a medium griddle until bubbles form on the surface, then flip and cook until golden.",
          "duration_minutes": 4,
          "temperature": "medium"
        },
        {
          "text": "Serve stacked with butter and maple syrup."
        }
      ]
    }
  ]
}
