{
  "slug": "spaghetti-aglio-e-olio",
  "title": "Spaghetti Aglio e Olio",
  "description": "A five-ingredient Roman classic: garlic and chilli sizzled in good olive oil, tossed with spaghetti.",
  "cuisine": "Italian",
  "category": "Main",
  "difficulty": "easy",
  "prep_minutes": 5,
  "cook_minutes": 15,
  "servings": 2,
  "visibility": "public",
  "attribution": "Late-night Roman comfort food.",
  "notes": null,
  "nutrition": {
    "calories": 624,
    "total_fat_g": 29.0,
    "saturated_fat_g": 4.1,
    "trans_fat_g": 0.0,
    "cholesterol_mg": 0,
    "sodium_mg": 8,
    "total_carbs_g": 77.2,
    "dietary_fiber_g": 3.6,
    "total_sugars_g": 2.8,
    "protein_g": 13.5,
    "source": "auto"
  },
  "ingredient_groups": [
    {
      "name": "",
      "ingredients": [
        { "quantity": 200, "unit": "g", "name": "spaghetti", "food": "spaghetti" },
        { "quantity": 4, "unit": "cloves", "name": "garlic", "note": "thinly sliced", "food": "garlic" },
        { "quantity": 60, "unit": "ml", "name": "extra-virgin olive oil", "food": "olive-oil" },
        { "quantity": 1, "unit": "tsp", "name": "red chilli flakes", "food": "red-pepper-flakes" },
        { "quantity": null, "unit": null, "name": "flat-leaf parsley", "note": "chopped", "food": "flat-leaf-parsley" },
        { "quantity": null, "unit": null, "name": "salt", "note": "for the pasta water, and to taste", "food": "kosher-salt" }
      ]
    }
  ],
  "step_groups": [
    {
      "name": "",
      "steps": [
        {
          "text": "Boil the spaghetti in water seasoned generously with salt until al dente, then reserve a cup of the pasta water before draining.",
          "duration_minutes": 9,
          "tip": "The starchy water is the sauce — reserve it before you drain, not after."
        },
        {
          "text": "Gently warm the olive oil and sliced garlic until the garlic is pale gold.",
          "duration_minutes": 4,
          "temperature": "low",
          "tip": "Do not let it brown. Browned garlic turns the whole dish bitter and there is no recovering it."
        },
        {
          "text": "Add the chilli flakes and a splash of the pasta water to emulsify."
        },
        {
          "text": "Toss the drained pasta in the oil, adding more pasta water until it turns glossy."
        },
        {
          "text": "Finish with the chopped parsley and serve immediately."
        }
      ]
    }
  ]
}
