{
  "slug": "blueberry-nectarine-galette",
  "title": "Blueberry Nectarine Galette",
  "description": "A free-form summer tart on a shop-bought crust — nectarines and blueberries, pleated by hand, chilled hard before it bakes so the edges hold.",
  "cuisine": "American",
  "category": "Dessert",
  "difficulty": "easy",
  "prep_minutes": 20,
  "cook_minutes": 35,
  "servings": 8,
  "visibility": "public",
  "attribution": "Secret Sauce Kitchen",
  "notes": null,
  "nutrition": {
    "calories": 200,
    "total_fat_g": 8.1,
    "saturated_fat_g": 3.0,
    "trans_fat_g": 0.0,
    "cholesterol_mg": 23,
    "sodium_mg": 127,
    "total_carbs_g": 30.8,
    "dietary_fiber_g": 1.9,
    "total_sugars_g": 11.9,
    "added_sugars_g": 6.3,
    "protein_g": 2.2,
    "source": "auto"
  },
  "ingredient_groups": [
    {
      "name": "Filling",
      "ingredients": [
        { "quantity": 2, "unit": null, "name": "nectarines", "note": "chopped", "food": "nectarine" },
        { "quantity": 1.5, "unit": "cups", "name": "fresh blueberries", "food": "blueberries" },
        { "quantity": 0.5, "unit": "tbsp", "name": "lemon zest", "food": "lemon-zest" },
        { "quantity": 1, "unit": "tbsp", "name": "fresh lemon juice", "food": "lemon-juice" },
        { "quantity": 0.25, "unit": "cup", "name": "organic cane sugar", "note": "adjust to the sweetness of the fruit", "food": "granulated-sugar" },
        { "quantity": 2, "unit": "tbsp", "name": "cornstarch", "food": "cornstarch" }
      ]
    },
    {
      "name": "To assemble",
      "ingredients": [
        { "quantity": 1, "unit": null, "name": "refrigerated pie crust", "food": "pie-crust" },
        { "quantity": 1, "unit": null, "name": "egg", "note": "beaten with 1 Tbsp water, for egg wash", "food": "egg" },
        { "quantity": null, "unit": null, "name": "turbinado sugar", "note": "for garnish", "food": "turbinado-sugar" }
      ]
    }
  ],
  "step_groups": [
    {
      "name": "",
      "steps": [
        {
          "text": "Preheat the oven to 400°F.",
          "temperature": "400°F"
        },
        {
          "text": "In a bowl, mix together the nectarines, blueberries, lemon juice, lemon zest, sugar, and cornstarch."
        },
        {
          "text": "Unroll the pie crust, flattening it with a rolling pin if needed to remove creases. It should be about 1/8-inch thick and 10-12 inches across. Place it on parchment paper on a large rimmed baking sheet."
        },
        {
          "text": "Using a slotted spoon, pile the fruit onto the centre of the crust and spread it into an even layer, leaving a 2-3 inch border.",
          "tip": "The slotted spoon matters — the juice left behind in the bowl is what would otherwise soak through the base."
        },
        {
          "text": "Fold the edges of the dough over the fruit, pleating as you go and pinching each fold gently to seal it."
        },
        {
          "text": "Chill the assembled galette on its baking sheet in the freezer.",
          "duration_minutes": 15,
          "tip": "Cold dough hits the hot oven and sets before it can slump."
        },
        {
          "text": "Brush the galette with the egg wash, sprinkle with turbinado sugar, and bake on the centre rack until golden brown and the filling is bubbling. Serve warm with vanilla ice cream.",
          "duration_minutes": 35,
          "temperature": "400°F"
        }
      ]
    }
  ]
}
