{
  "slug": "fresh-guacamole",
  "title": "Fresh Guacamole",
  "description": "Bright, chunky avocado dip with lime, coriander, and a little heat. Ready in minutes.",
  "cuisine": "Mexican",
  "category": "Appetizer",
  "difficulty": "easy",
  "prep_minutes": 15,
  "cook_minutes": 0,
  "servings": 4,
  "visibility": "public",
  "attribution": null,
  "notes": null,
  "nutrition": {
    "calories": 250,
    "total_fat_g": 22,
    "saturated_fat_g": 3.2,
    "trans_fat_g": 0,
    "cholesterol_mg": 0,
    "sodium_mg": 310,
    "total_carbs_g": 16,
    "dietary_fiber_g": 11,
    "total_sugars_g": 2,
    "added_sugars_g": 0,
    "protein_g": 3
  },
  "ingredient_groups": [
    {
      "name": "",
      "ingredients": [
        { "quantity": 3, "unit": null, "name": "ripe avocados", "food": "avocado" },
        { "quantity": 1, "unit": null, "name": "lime", "note": "juiced", "food": "lime" },
        { "quantity": 0.5, "unit": null, "name": "red onion", "note": "finely diced", "food": "onion" },
        { "quantity": 1, "unit": null, "name": "jalapeño", "note": "minced", "food": "jalapeno" },
        { "quantity": null, "unit": null, "name": "fresh coriander", "note": "chopped", "food": "coriander" },
        { "quantity": null, "unit": null, "name": "salt", "note": "to taste", "food": "kosher-salt" }
      ]
    }
  ],
  "step_groups": [
    {
      "name": "",
      "steps": [
        {
          "text": "Halve the avocados and scoop the flesh into a bowl."
        },
        {
          "text": "Mash to your preferred texture — leave it chunky."
        },
        {
          "text": "Fold in the lime juice, red onion, jalapeño, and coriander."
        },
        {
          "text": "Season with salt and serve right away with tortilla chips.",
          "tip": "It browns fast. Press cling film onto the surface if it has to wait."
        }
      ]
    }
  ]
}
