{
  "slug": "teriyaki-pork-pineapple-skewers",
  "title": "Teriyaki Pork & Pineapple Skewers",
  "description": "Pork and pineapple charred on the grill and brushed with a teriyaki glaze you reduce yourself — mirin, tamari, honey, ginger, and enough chilli to keep it from being sweet.",
  "cuisine": "Japanese",
  "category": "Main",
  "difficulty": "medium",
  "prep_minutes": 25,
  "cook_minutes": 15,
  "servings": 4,
  "visibility": "public",
  "attribution": "Secret Sauce Kitchen",
  "notes": null,
  "nutrition": {
    "calories": 371,
    "total_fat_g": 6.4,
    "saturated_fat_g": 1.3,
    "trans_fat_g": 0.0,
    "cholesterol_mg": 74,
    "sodium_mg": 1243,
    "total_carbs_g": 54.0,
    "dietary_fiber_g": 4.9,
    "total_sugars_g": 41.3,
    "added_sugars_g": 13.0,
    "protein_g": 28.2,
    "source": "auto"
  },
  "ingredient_groups": [
    {
      "name": "Teriyaki sauce",
      "ingredients": [
        { "quantity": 0.5, "unit": "cup", "name": "mirin" },
        { "quantity": 0.5, "unit": "cup", "name": "pineapple juice", "note": "orange juice also works", "food": "pineapple-juice" },
        { "quantity": 0.25, "unit": "cup", "name": "tamari", "food": "tamari" },
        { "quantity": 3, "unit": "tbsp", "name": "honey", "food": "honey" },
        { "quantity": 1, "unit": "tbsp", "name": "rice vinegar", "food": "rice-vinegar" },
        { "quantity": 2, "unit": "cloves", "name": "garlic", "note": "grated", "food": "garlic" },
        { "quantity": 1, "unit": "inch", "name": "fresh ginger", "note": "grated", "food": "ginger" },
        { "quantity": 1, "unit": "tsp", "name": "red pepper flakes", "note": "or to taste", "food": "red-pepper-flakes" },
        { "quantity": 1, "unit": "tsp", "name": "cornstarch", "food": "cornstarch" },
        { "quantity": 1, "unit": "tbsp", "name": "water", "food": "water" }
      ]
    },
    {
      "name": "Pork and skewers",
      "ingredients": [
        { "quantity": 1, "unit": "lb", "name": "pork", "note": "cut for kabobs", "food": "pork-tenderloin" },
        { "quantity": 1, "unit": "tbsp", "name": "olive oil", "food": "olive-oil" },
        { "quantity": 2, "unit": "tsp", "name": "tamari", "food": "tamari" },
        { "quantity": 1, "unit": "tsp", "name": "smoked paprika", "food": "smoked-paprika" },
        { "quantity": null, "unit": null, "name": "salt and black pepper", "note": "to taste" },
        { "quantity": 1, "unit": null, "name": "pineapple", "note": "small, skin and core removed", "food": "pineapple" },
        { "quantity": 1, "unit": null, "name": "red bell pepper", "note": "stemmed and seeded", "food": "red-bell-pepper" },
        { "quantity": 1, "unit": null, "name": "yellow onion", "food": "onion" },
        { "quantity": 6, "unit": null, "name": "bamboo skewers", "note": "4-6, soaked in water at least 30 minutes" }
      ]
    }
  ],
  "step_groups": [
    {
      "name": "Teriyaki sauce",
      "steps": [
        {
          "text": "In a small saucepan, whisk together the mirin, pineapple juice, tamari, honey, rice vinegar, garlic, ginger, and red pepper flakes. Bring to a low boil, reduce the heat to medium, and simmer until slightly reduced.",
          "duration_minutes": 10,
          "temperature": "medium"
        },
        {
          "text": "In a small bowl, whisk together the cornstarch and water, then whisk that into the sauce. Cook and stir until thickened and bubbly.",
          "duration_minutes": 2,
          "tip": "Mix the slurry with cold water and add it off a hard boil, or it seizes into lumps."
        }
      ]
    },
    {
      "name": "Skewers",
      "steps": [
        {
          "text": "Pat the pork dry and cut it into 1 1/2-inch cubes if needed. Sprinkle with salt, black pepper, smoked paprika, and tamari, then toss with the olive oil to coat."
        },
        {
          "text": "Set the pork aside to marinate.",
          "duration_minutes": 30
        },
        {
          "text": "Cut the pineapple, bell pepper, and yellow onion into 1 1/2-inch pieces, then load them onto the soaked skewers alternating with the pork."
        },
        {
          "text": "Grill or broil on high, brushing with the teriyaki sauce and turning every 3-5 minutes, until the pork is cooked through and lacquered.",
          "duration_minutes": 15,
          "temperature": "high",
          "tip": "Keep back some sauce for serving — anything that touched raw pork goes on the grill, not the table."
        }
      ]
    }
  ]
}
