{
  "slug": "brown-butter-chocolate-chip-cookies",
  "title": "Brown Butter Chocolate Chip Cookies",
  "description": "Crisp edges, chewy centres, and pools of dark chocolate, deepened with nutty brown butter.",
  "cuisine": "American",
  "category": "Dessert",
  "difficulty": "easy",
  "prep_minutes": 20,
  "cook_minutes": 11,
  "servings": 24,
  "visibility": "public",
  "attribution": "A tweaked take on the classic Toll House cookie.",
  "notes": null,
  "nutrition": {
    "calories": 184,
    "total_fat_g": 9.8,
    "saturated_fat_g": 5.8,
    "trans_fat_g": 0.0,
    "cholesterol_mg": 31,
    "sodium_mg": 34,
    "total_carbs_g": 22.1,
    "dietary_fiber_g": 1.2,
    "total_sugars_g": 12.3,
    "added_sugars_g": 12.2,
    "protein_g": 2.2,
    "source": "auto"
  },
  "ingredient_groups": [
    {
      "name": "",
      "ingredients": [
        { "quantity": 170, "unit": "g", "name": "butter", "food": "butter" },
        { "quantity": 150, "unit": "g", "name": "brown sugar", "food": "brown-sugar" },
        { "quantity": 100, "unit": "g", "name": "white sugar", "food": "granulated-sugar" },
        { "quantity": 1, "unit": null, "name": "egg", "food": "egg" },
        { "quantity": 1, "unit": null, "name": "egg yolk", "food": "egg-yolk" },
        { "quantity": 1, "unit": "tsp", "name": "vanilla extract", "food": "vanilla-extract" },
        { "quantity": 250, "unit": "g", "name": "all-purpose flour", "food": "all-purpose-flour" },
        { "quantity": 0.5, "unit": "tsp", "name": "baking soda", "food": "baking-soda" },
        { "quantity": 200, "unit": "g", "name": "dark chocolate", "note": "chopped", "food": "dark-chocolate" }
      ]
    }
  ],
  "step_groups": [
    {
      "name": "",
      "steps": [
        {
          "text": "Brown the butter until it smells nutty, then let it cool slightly.",
          "duration_minutes": 6,
          "temperature": "medium",
          "tip": "Watch the milk solids, not the clock — they go from golden to burnt in seconds."
        },
        {
          "text": "Whisk in both sugars, the egg, the yolk, and the vanilla until smooth."
        },
        {
          "text": "Fold in the flour and baking soda, then the chopped chocolate."
        },
        {
          "text": "Chill the dough for deeper flavour.",
          "duration_minutes": 30
        },
        {
          "text": "Scoop onto trays and bake until the edges set but the centres still look underdone.",
          "duration_minutes": 11,
          "temperature": "350°F"
        },
        {
          "text": "Cool on the tray so they finish setting."
        }
      ]
    }
  ]
}
